Text,Answers0,Answers1,Answers2,Answers3,Explanation,Difficulty
Зачем нужна консоль в Unity?,"Отображение ошибок, ворнингов и логов.",Просмотр и редактирование текстовых файлов.,Загрузка пакетов и ассетов.,Выполнение инструкций командной строки,Консоль в Unity - это инструмент для отображения сообщений и вывода информации о работе приложения во время его выполнения. Она играет важную роль в процессе разработки и отладки игр и приложений.,1
Что такое префабы (Prefabs) в Unity3D?,"Это объекты, которые можно использовать для создания копий в сцене.",Это готовые 3D модели для использования на сцене.,Это скрипты для управления игровым процессом.,Это компоненты для работы с физикой объектов.,"Префабы (Prefabs) в Unity3D представляют собой шаблоны объектов, которые можно создавать, настраивать и использовать множество раз на сцене. Они позволяют создавать однотипные объекты с одним и тем же набором компонентов, свойств и настроек.

Когда вы создаете префаб, он становится своеобразным ""макетом"" объекта, и его экземпляры на сцене будут отображаться так же, как исходный префаб, с возможностью внесения индивидуальных изменений для каждого экземпляра.",2
Какие данные в себе хранит меш?,"Меш хранит данные о атрибутах, определяющих внешний вид объекта.",Меш хранит информацию о координатах объекта в игровом пространстве.,Меш хранит данные о характеристиках процессора и оперативной памяти компьютера для оптимизации производительности.,Меш хранит данные о пользовательском вводе и управлении для обработки действий игрока в игровом движке.,"Меш определяет форму и внешний вид объекта, включая его вершины, грани, текстурные координаты и другие атрибуты. 
Вершины (Vertices): Меш содержит список вершин, которые определяют позицию точек в трехмерном пространстве. 
Грани (Faces): Меш определяет грани, которые соединяют вершины и определяют форму объекта. Грани могут быть треугольниками, четырехугольниками или полигонами более сложной формы.
Нормали (Normals): Нормали указывают направление поверхности в каждой вершине и используются для расчета освещения и отражения света от объекта.
Текстурные координаты (Texture Coordinates): Меш может содержать текстурные координаты, которые связывают вершины с соответствующими точками на текстуре. ",3
Что такое метод?,Набор инструкций.,"Это объект, который содержит данные и поведение класса.","Это свойство объекта, которое хранит данные для класса.",Часть интерфейса.,"Метод - это блок кода, объединенный внутри класса в объектно-ориентированном программировании, который выполняет определенные операции или действия. Методы представляют собой функции, которые могут принимать параметры, выполнять вычисления, взаимодействовать с данными класса и возвращать результаты.

Они являются основными строительными блоками поведения классов и позволяют выполнить определенные действия над объектами данного класса. Методы определяют поведение объектов и дает возможность использовать их в коде программы, вызывая методы и передавая необходимые аргументы.",3
Что такое canvas?,"Это компонент, который используется для отображения пользовательского интерфейса.",Это библиотека для работы с графикой и изображениями в Unity.,Canvas в Unity используется для рисования текстур и спрайтов на экране.,Это панель управления настройками и настроек проекта в Unity.,"Canvas (холст) в Unity - это компонент, который используется для отображения пользовательского интерфейса (UI) на экране. Он представляет собой плоскую поверхность, на которой размещаются различные элементы UI, такие как текст, изображения, кнопки и другие интерактивные элементы.

Canvas позволяет создавать гибкий и адаптивный пользовательский интерфейс, который автоматически масштабируется и подстраивается под разные разрешения экрана и устройства.",4
Что такое ООП?,"Парадигма, которая ориентирована на описание программных систем в терминах объектов и их взаимодействия.","Методология программирования, главная цель которой сделать код максимально линейным.","Технология, позволяющая взаимодействовать с цифровыми системами на естественных языках.","Способ организации кода, в котором все операции выполняются последовательно, без использования абстракций.","ООП, или объектно-ориентированное программирование, это методология программирования, которая ориентирована на организацию кода в виде объектов, которые представляют реальные сущности или абстракции. В объектно-ориентированном программировании данные и функции, которые с ними связаны, объединяются в единые сущности, называемые объектами.",5
Что такое класс?,"Тип данных, определяемый пользователем.","Это объект, который содержит данные и поведение программы.","Это тип данных, который используется для хранения числовых значений.","Это функция, которая выполняет определенные действия в программе.","
Класс - это шаблон или описание, которое определяет состояние (поля) и поведение (методы) объектов в ООП. Класс является фундаментальной концепцией ООП и служит для создания объектов - экземпляров класса.

Класс определяет общие характеристики для группы объектов, которые будут созданы на его основе. Он объединяет данные (поля) и операции (методы), которые связаны с определенной сущностью, и определяет поведение и свойства, которыми обладают объекты этого класса.",5
Зачем нужен аниматор?,"Позволяет создавать и управлять различными анимациями, переходами и параметрами.",Предназначен для создания и редактирования 3D моделей.,Предоставляет инструменты для работы с физическими эффектами и симуляциями.,Позволяет создавать мультфильмы в Unity.,"Аниматор в Unity - это компонент, который позволяет создавать и управлять анимациями объектов на сцене. 
Некоторые из основных возможностей:
Создание анимаций с использованием графического редактора Animator Controller.
Управление параметрами анимаций для плавного перехода между состояниями анимации.
Применение анимаций к различным состояниям объектов (например, покой, движение, атака и т. д.).
Синхронизация анимаций с другими компонентами и событиями в игре.
Создание анимаций с помощью скриптов, чтобы обеспечить динамичные и реагирующие на действия игроков анимации.",6
Какой компонент Unity3D используется для воспроизведения звуковых эффектов?,Audio Source,Camera,Light,Particle System,"Для воспроизведения звуковых эффектов в Unity3D используется компонент AudioSource. Компонент AudioSource позволяет управлять воспроизведением звуковых файлов, таких как аудио эффекты, звуки среды, музыка и т.д.

Вы можете добавить компонент AudioSource к любому игровому объекту, который будет играть звуковой эффект, и настроить его свойства, такие как аудио-файл для воспроизведения, громкость, позицию в пространстве и т.д. Кроме того, AudioSource имеет методы для управления воспроизведением, такие как Play() для начала воспроизведения, Pause() для паузы, Stop() для остановки и т.д.",7
Какой компонент Unity3D используется для отображения текста на сцене?,Text Mesh Pro,Light,Collider,Particle System,"Text Mesh Pro (TMP) - это пакет и компонент для работы с текстом в Unity, предоставляющий богатый набор возможностей и улучшений по сравнению с стандартным компонентом Text. Он разработан и поддерживается компанией Unity Technologies.",7
Что такое суперкласс?,"Класс, явлющийся родительским, от которого наследуют другие.","Класс, который произведен от нескольких подклассов одновременно.","Класс, который не может иметь своего собственного кода и может только наследовать код из других классов.","Класс, который используется только в статических контекстах программы.","Суперкласс (также называемый родительским классом или базовым классом) в объектно-ориентированном программировании представляет собой класс, от которого произошел другой класс, называемый подклассом или дочерним классом.

При наследовании, класс-потомок (подкласс) наследует атрибуты и методы класса-предка (суперкласса) и может добавлять свои собственные атрибуты и методы. В этом смысле суперкласс предоставляет общий набор функциональности, который может быть переиспользован в нескольких подклассах, способствуя повторному использованию кода и поддержке принципов абстракции и инкапсуляции.",8
Что такое MonoBehaviour? ,"Это базовый класс в Unity, который позволяет создавать и прикреплять компоненты к игровым объектам.","Это компонент, который отвечает за создание физических объектов в игре.",Это среда разработки для создания пользовательского интерфейса в Unity.,"Это базовый класс, который предоставляет доступ к базовым математическим операциям в Unity.","MonoBehaviour - это базовый класс в Unity, который позволяет создавать компоненты, взаимодействующие с объектами на сцене. Класс MonoBehaviour предоставляет возможность добавлять поведение к игровым объектам, таким как персонажи, предметы, камеры, и т.д.

При создании скриптов в Unity, они должны быть унаследованы от MonoBehaviour. Это позволяет использовать различные методы MonoBehaviour, такие как Start(), Update(), FixedUpdate(), и другие, которые автоматически вызываются движком Unity в определенные моменты жизненного цикла объекта.",9
Какой компонент Unity3D позволяет объектам взаимодействовать с другими объектами на сцене через коллизии и триггеры?,Collider,Mesh Renderer,Camera,Light,"Collider - это базовый компонент, который позволяет определить границы и форму объекта для обнаружения столкновений с другими объектами. Collider не обрабатывает логику столкновений, а просто определяет области, которые могут взаимодействовать с другими коллайдерами.",9
Что в иерархии используется для организации игровых объектов в группы?,Empty objects,Canvas, Event systems,Mesh renderers,"Occlusion map (карта заслонения) - это текстурная карта, которая используется для определения видимости объектов на сцене относительно источника света или камеры. 

Основное предназначение occlusion map состоит в том, чтобы определить, какие пиксели объектов находятся в тени или скрыты другими объектами на сцене. Это позволяет исключить ненужные пиксели из процесса освещения и рендеринга, что увеличивает производительность и позволяет создавать более реалистичные и детализированные сцены.",10
Что такое конструктор?,"Особый метод с именем класса, который запускается при инициализации класса.","Это специальный метод, который вызывается в классе для завершения работы программы.","Это метод, который вызывается в классе во время компиляции.","Особый метод, который используется для передачи данных между различными классами.","Конструктор - это специальный метод в классе, который вызывается автоматически при создании объекта данного класса. 

Основная задача конструктора - обеспечить корректное инициализацию объекта перед его использованием. Он позволяет задать значения полям класса и выполнить другие настройки, чтобы объект был готов к работе сразу после создания.

В языке C#, имя конструктора совпадает с именем класса. Конструктор может быть перегружен, что означает, что в классе может быть несколько конструкторов с разными параметрами. ",11
Какой метод в MonoBehaviour вызывается при активации объекта на сцене?,OnEnable,OnStart,OnActivate,OnAttach,"Метод OnEnable() - это метод в Unity, который вызывается каждый раз, когда компонент становится активным на сцене. Он выполняется после метода Awake() при активации объекта или после включения компонента в объекте.",11
Что такое объект в ООП?, Это экземпляр класса.,"Это свойство класса, которое хранит данные для последующего использования.","Это принцип программирования, который гласит, что каждый класс должен иметь только один объект.",Это значение.,"Объект - это экземпляр класса в ООП. Класс определяет структуру и поведение объектов, а объект представляет конкретный экземпляр этого класса, обладающий уникальным состоянием и поведением.

Класс - это шаблон или описание, которое определяет свойства (поля) и методы (функции), которыми обладает объект данного класса. Он является абстракцией, определяющей общие характеристики для группы объектов.

Объект - это конкретное воплощение класса со своими уникальными значениями свойств и поведением.",12
Что такое обработка исключений?,Механизм перехвата и обработки ошибок для избежания прекращения работы или падения программы.,Механизм уведомления пользователя о проблемах в программе.,Механизм экстренного прекращения работы программы в случае перехвата ошибок.,Механизм для игнорирования ошибок выполнения программы.,"Обработка исключений - это механизм, который позволяет обрабатывать и управлять ошибками и исключительными ситуациями в программе. Когда возникает исключение, это сигнализирует о нестандартной ситуации или ошибке, которая может повлиять на нормальное выполнение программы.

Вместо того чтобы допустить аварийное завершение программы при возникновении исключения, обработка исключений позволяет перехватить и обработать ошибку, предпринять соответствующие действия или продолжить выполнение программы с учетом возникшей ситуации.",13
Какой из следующих компонентов Unity3D используется для работы с физикой и столкновениями объектов?,Rigidbody,Transform,Audio Listener, Mesh Renderer,"Компонент Unity3D, который используется для работы с физикой и столкновениями объектов, называется ""Rigidbody"". Rigidbody добавляется к объектам, чтобы имитировать физическое поведение, такое как гравитация, столкновения и взаимодействия с другими объектами в сцене.",13
"При создании ресурсов, таких как меши для Unity, какую единицу измерения рекомендуется использовать?",Метры,Футы,Кубиты,Дюймы,Основной единицей измерения в Unity является метр (meter). Все размеры и координаты объектов в сцене задаются в метрах.,14
Для чего нужны нормали?,"Нормали указывают на направление поверхности и используются для определения, как свет будет взаимодействовать с объектом.",Нормали используются для определения глубины и плотности объекта в трехмерном пространстве.,"Нормали служат для управления физическими свойствами объекта, такими как его масса и трение.",Нормали используются для определения аудио-эффектов и звуковых свойств объекта.,"Нормали в трехмерной графике используются для определения направления поверхности в каждой вершине меша. Они используются для расчета освещения объектов. Освещение зависит от угла между нормалями поверхности и направлением источника света. Это позволяет создавать реалистичные эффекты светотени и отражений на поверхностях объектов. Нормали также используются для расчета теней. По мере движения источника света, нормали помогают определить, какие части объекта должны находиться в тени, а какие - на свету.

Еще нормали могут быть использованы для расчета столкновений и коллизий объектов. 
",15
