Text,Answers0,Answers1,Answers2,Answers3,Explanation,Difficulty
Как получить ближайшую сверху к числу number степень двойки в С#?,"double result = Math.Pow(2, Math.Ceiling(Math.Log(number, 2)));","double result = Math.Log(number, 2);","double result = Math.Ceiling(Math.Pow(2, Math.Log(number, 2)));",double result = Math.Log(Math.Pow(Math.Ceiling(number)));,"Math.Pow(base, exponent) - функция, возводящая базу в указанный показатель степени.
Math.Ceiling(value) - функция, округляющая значение вверх до ближайшего целого числа.
Math.Log(number, base) - функция, вычисляющая натуральный логарифм числа по указанному основанию. 
То есть, сначала вычистяем логарифм числа по основанию 2, округляем вверх и возводим 2 в  полученную степень. Полезно при вычислении буферов памяти и при работе с размерами текстур.",68
Что такое асимптотическая сложность алгоритма?,Асимптотическая сложность - это оценка поведения алгоритма по мере увеличения размера входных данных.,"Асимптотическая сложность - это количество операций, выполняемых в алгоритме, независимо от размера входных данных.","Асимптотическая сложность - это точное количество шагов, необходимых для выполнения алгоритма.","Асимптотическая сложность алгоритма - это количество байтов памяти, занимаемых алгоритмом в процессе выполнения.","Асимптотическая сложность позволяет оценить, как быстро растет время выполнения или количество ресурсов, таких как память или процессорное время, потребляемых алгоритмом при увеличении размера входных данных.

Асимптотическая сложность обычно выражается с помощью ""О-большого"" (Big O) нотации. В нотации ""О-большого"" указывается верхняя граница роста алгоритма в зависимости от размера входных данных. Например, если сложность алгоритма оценивается как O(n^2), где n - размер входных данных, это означает, что время выполнения алгоритма будет расти пропорционально квадрату размера входных данных.",68
"В чем состоит ""Принцип разделения интерфейса"" (4 принцип SOLID)?","Много маленьких специализированных интерфейсов лучше, чем один общий интерфейс.",Интерфейс должен содержать как можно больше методов для упрощения кода.,"Каждый интерфейс должны быть реализован одним классом, чтобы избежать дублирования кода.",Все классы должны реализовывать общий интерфейс с обязательными методами.,"Принцип разделения интерфейса:
""Много маленьких специализированных интерфейсов лучше, чем один общий интерфейс.""
Суть этого принципа состоит в том, чтобы разделять большие и сложные интерфейсы на много маленьких и специализированных таким образом, чтобы клиенты могли реализовывать только те методы, которые им действительно необходимы, а не быть принужденными реализовывать лишние методы.",69
Чем абстрактный класс отличается от интерфейса?,"Абстрактный класс может предоставлять реализацию методов и свойств, в то время как интерфейс только определяет сигнатуры.","Абстрактный класс может использоваться для создания экземпляров объектов, в то время как интерфейс не может.","Абстрактный класс может реализовывать несколько интерфейсов, а интерфейс может наследовать только один абстрактный класс.",Абстрактный класс и интерфейс предоставляют одинаковую функциональность и могут использоваться взаимозаменяемо.,"Абстрактный класс может предоставлять реализацию методов и свойств, в то время как интерфейс только определяет сигнатуры методов и свойств, но не предоставляет их реализацию. 
Класс может наследовать только один абстрактный класс, но реализовывать множество интерфейсов. 
Абстрактный класс может предоставлять общую функциональность для классов-наследников и определять базовую структуру и поведение. Интерфейсы определяют только контракты, которые класс должен реализовать, но не предоставляют общей реализации.
Абстрактный класс может быть расширен путем добавления новых методов, свойств и полей, в то время как интерфейс, как правило, не подвержен изменениям, чтобы не нарушать существующие контракты.",70
От чего наследуется MonoBehaviour? ,от класса Behaviour,от класса Class,от класса Object,от класса Component,MonoBehaviour наследуется от класса Behaviour. Класс Behaviour в свою очередь наследуется от класса Component. Component является базовым классом для всех компонентов в Unity.,70
Что такое перегрузка операторов?,Это возможность определить новое поведение операторов для пользовательских типов данных.,Это возможность менять порядок выполнения операций прямо во время выполнения программы.,"Это возможность создавать новые операторы, не связанные с уже существующими.","Это конструкция с  ключевым словом overload, позволяющая выполнять оператор несколько раз подряд.","Перегрузка операторов - это механизм, который позволяет определить специальное поведение операторов при работе с объектами пользовательских классов. Это позволяет использовать стандартные операторы, такие как +, -, *, /, ==, !=, и другие, для объектов пользовательских классов, а также определить свою логику для их работы.
    // Перегрузка оператора сложения
    public static Point operator +(Point p1, Point p2)
    {
        return new Point(p1.X + p2.X, p1.Y + p2.Y);
    }",71
Что такое переполнение стека (stack overflow)?,"Это ситуация, когда стек памяти заполняется больше, чем его максимальная емкость.","Это ошибка, при попытке присвоить значение переменной, которое выходит за пределы диапазона этой переменной.","Это ситуация, когда программе не хватает оперативной памяти для выполнения задач.","Это ошибка, возникающая при попытке доступа к несуществующей памяти или объекту в программе.","Переполнение стека (stack overflow) - это ситуация, когда стек памяти, используемый для хранения локальных переменных, параметров методов и контекста вызова функций, заполняется больше, чем его максимальная емкость. 

Переполнение стека обычно происходит, когда рекурсивная функция вызывает саму себя или когда вложенные функции вызываются слишком глубоко и не освобождаются из стека вовремя. 

При переполнении стека обычно возникает исключение ""StackOverflowException"", которое приводит к прекращению работы программы или аварийному завершению. ",72
Что такое Animation Rigging в Unity?,"Это система для создания и управления сложными анимациями с помощью управляемых костей и контролов.





",Это метод для управления положением объектов в сцене с помощью уравнений кинематики.,Это технология для создания и управления светом в сцене.,Это система для оптимизации и управления ресурсами в проекте.,"Animation Rigging в Unity - это набор инструментов и система, которая позволяет создавать сложные анимации персонажей и объектов с использованием программных контроллеров и управлять костями и мешами для достижения более реалистичных и уникальных движений. Это позволяет аниматорам и разработчикам создавать более динамичные и интересные анимации, а также упрощает процесс анимирования сложных объектов и персонажей.",72
Можно ли хранить разные типы данных в C# в объекте класса System.Array?,"Хранение разных типов данных в массиве возможно, но в виде объектов.",Хранение разных типов данных в массиве приводит к потере точности и ошибкам при доступе к элементам.,System.Array автоматически преобразует все элементы в единый тип данных.,"Нет, в массиве можно хранить только однородные элементы одного типа данных.","System.Array является базовым классом для всех массивов в C# и позволяет хранить элементы различных типов в единственном массиве.
Array myArray = new object[5];
myArray[0] = ""Привет"";
myArray[1] = 10;
myArray[2] = true;
myArray[3] = 3.14;
myArray[4] = DateTime.Now;
Однако, при работе с System.Array следует учитывать, что элементы хранятся в виде объектов, и при доступе к ним может потребоваться явное приведение типа обратно к исходному типу для использования конкретных функций или свойств. ",73
"В чем состоит ""Принцип инверсии зависимостей"" (5 принцип SOLID)?",Высокоуровневые модули не должны зависеть от низкоуровневых модулей. Оба типа модулей должны зависеть от абстракций.,"Высокоуровневые модули должны зависеть от низкоуровневых модулей, абстракции должны зависеть от деталей.","Классы должны зависеть только от конкретных реализаций, а не от абстракций.","Классы должны быть написаны так, чтобы они не могли изменить свое поведение во время выполнения.","Принцип инверсии зависимостей:
Высокоуровневые модули не должны зависеть от низкоуровневых модулей. Оба типа модулей должны зависеть от абстракций.
Абстракции не должны зависеть от деталей. Детали должны зависеть от абстракций.
Предположим, у нас есть класс OrderProcessor, который зависит от класса DatabaseConnection для доступа к базе данных. Если мы хотим использовать другой источник данных, нам придется изменить класс OrderProcessor. Вместо этого, мы можем ввести абстракцию, например, интерфейс IDatabaseConnection, и сделать OrderProcessor зависимым только от этого интерфейса. Теперь мы можем легко заменить DatabaseConnection другой реализацией, не затрагивая OrderProcessor.",74
Для чего обычно используется событие OnAnimatorMove в объектах MonoBehaviour?,Для перехвата и обработки обновлений позиции и вращения анимированного объекта.,Для воспроизведения анимации после ее завершения.,Для синхронизации анимации объекта с текущим временем.,Для обнаружения любого движения объекта.,"Событие OnAnimatorMove в объектах MonoBehaviour обычно используется для перехвата и обработки обновлений позиции и вращения объекта, которые были применены аниматором в кадре. Это позволяет программисту влиять на движение объекта, учитывая анимацию, и добавлять дополнительную логику, связанную с движением и анимацией, в скрипты объекта.",74
Какой фрагмент кода C# постоянно обновляет ось Y?,"transform.Rotate(Vector3.right, RotSpeed * Time.deltaTime);","transform.localRotation *= Quaternion.Euler(0f, RotSpeed * Time.deltaTime, 0f);","transform.RotateAround(Vector3.up, RotSpeed * Time.deltaTime);",transform.SetParent(null);,Метод transform.Rotate в Unity используется для вращения игрового объекта в трехмерном пространстве. Он позволяет изменить ориентацию объекта относительно его текущего положения.,75
Как yield используется в итераторах?,"yield используется для определения значений, которые должны быть возвращены при каждой итерации.",yield используется для объявления переменных в итераторах.,yield используется для создания делегатов и событий в C#.,yield используется для определения начала выполнения каждой итерации.,"В итераторах yield используется для определения значений, которые должны быть возвращены при каждой итерации. Когда исполнение доходит до инструкции yield return, значение возвращается из итератора, а выполнение приостанавливается. 
public static IEnumerable<int> GetNumbers()
    {
        yield return 1;
        yield return 2;
        yield return 3;
        yield return 4;
        yield return 5;
    }",76
Что такое Assets Bundle?,"Пакет, содержащий один или несколько файлов ресурсов.","Специальная папка, содержащая скрипты и ресурсы.","Устаревший и не используемый в Unity способ управления ресурсами, замененный другими методами.",Формат файлов для хранения компилированных скриптов в Unity.,"Assets Bundle (пакет ресурсов) в Unity - это специальный файл, который содержит один или несколько ресурсов (таких как текстуры, модели, аудио, видео и другие) упакованных в одну единицу. Эти пакеты могут быть созданы и загружены в игре динамически, что позволяет управлять ресурсами более эффективно.
Assets Bundle предоставляют разработчикам более гибкий и эффективный способ управления ресурсами в Unity, что особенно важно для мобильных платформ и игр с большим объемом контента.",76
Что такое Shader Graph в Unity?,"Это визуальный графический инструмент, который позволяет создавать шейдеры без необходимости писать код. ","Это плагин для Unity, который позволяет экспортировать графические эффекты.","Это компонент в Unity, который позволяет создавать динамические визуальные эффекты для объектов на сцене.","Это система в Unity, которая отвечает за управление физической симуляцией объектов.","Shader Graph в Unity - это визуальный графический инструмент, который позволяет создавать шейдеры (материалы) для объектов на сцене без необходимости писать код. Он предоставляет интерфейс для создания комплексных шейдеров с помощью соединения готовых блоков, представляющих различные шейдерные функции и операции.",77
"Игровой объект пули быстро перемещается по сцене с помощью компонента RigidBody. Иногда он проходит сквозь твердые объекты, даже когда у них есть коллайдер. Как это исправить?",Изменить свойство Collision Detection Rigidbody на Continuous Dynamic или Continuous Speculative.,Включить свойство Rigidbody IsKinematic.,"Увеличить значение Fixed Time Step в диалоговом окне Project Settings, чтобы изменить частоту события FixedUpdate.","Надо увеличить размер коллайдеров, чтобы более эффективно обнаруживать столкновения.","У Collision Detection, отвечающий за обнаружение столкновений есть несколько параметров:
Discrete: Значение по умолчанию. Столкновения обрабатываются на основе расчетов за каждый кадр. Это подходит для большинства объектов.
Continuous: Используется непрерывная обработка столкновений. Это позволяет предотвратить проникновение объектов друг в друга при высоких скоростях. Однако этот режим затратен с точки зрения производительности.
Continuous Dynamic: Этот режим комбинирует преимущества дискретной и непрерывной обработки столкновений.
Continuous Speculative: Это расширение режима Continuous, которое делает предположения о будущем положении объекта на основе его скорости.",78
Что такое Lerp в Unity ?,"Lerp - это метод, который позволяет плавно перемещаться между двумя значениями.","Lerp - это аббревиатура от ""Lighting Effects Render Pipeline"", специальной технологии для улучшения рендера света.","Lerp - это тип материала, применяемый к объектам для изменения их физических свойств, таких как упругость или трение.","Lerp - это специальный вид игровых персонажей, которые перемещаются по заданной траектории на экране.","В Unity Lerp (Linear Interpolation) является функцией, предоставляемой внутри фреймворка Unity для выполнения линейной интерполяции между двумя значениями в рамках временной оси. Функция Lerp в Unity может использоваться для плавного перемещения объектов, изменения их размера, изменения цвета или прозрачности, а также для создания анимации между двумя значениями.

В Unity функция Lerp использует следующий синтаксис:
Vector3.Lerp(start, end, t);
start и end - начальное и конечное значения, между которыми выполняется интерполяция.
t - весовой коэффициент (время), находящийся в диапазоне от 0 до 1. ",78
