Text,Answers0,Answers1,Answers2,Answers3,Explanation,Difficulty
В чем различие между классом и структурой?,"Классы поддерживают наследование, структуры нет. Объекты класса передаются по ссылке, структуры - по значению.","Классы могут содержать методы, а структуры - только поля.","Классы нужно инициализировать с помощью ключевого слова ""new"", структуры не нужно.","Классы наследуют другие классы, а структуры только другие структуры.","Классы поддерживают наследование. Структуры не поддерживают. Объекты класса передаются по ссылке, изменения, внесенные в один объект, могут повлиять на другие объекты, которые ссылаются на тот же экземпляр. Структуры передаются по значению, каждый экземпляр структуры содержит свою собственную копию данных.
Объекты класса хранятся в куче (heap). Структуры хранятся в стеке (stack) или в куче.
Поля класса могут иметь значение ""null"", если они не инициализированы. Поля структуры всегда должны иметь значение.
В общем случае, работа со структурами может быть более эффективной по производительности.",56
Когда автоматически вызывается метод Reset?,При добавлении компонента к объекту или сбросе его значений в режиме редактирования.,Когда игровой объект перемещается из одной сцены в другую.,Когда сцена стартует или перезапускается.,Когда сцена стартует или перезапускается для деактивированного игрового объекта.,"Метод Reset() автоматически вызывается в Unity для компонентов, когда они добавляются на объект или сбрасываются в значения по умолчанию. Это происходит в следующих случаях:

При добавлении компонента на объект в сцене или в префабе.
При сбросе компонента до значений по умолчанию, что можно сделать через контекстное меню компонента или кнопку ""Reset"" в инспекторе компонента.",56
Явное приведение типа это:,double d = 10.5; int i = (int)d;,int i = 10; double d = i;,"string str = ""10""; int i = int.Parse(str);",double d = 10.5; int i = Convert.ToInt32(d);,"Явное приведение типа (explicit type casting) в C# - это операция, которая позволяет явно изменить тип значения из одного типа в другой. При явном приведении типа разработчик явно указывает, что хочет преобразовать значение из одного типа в другой, даже если такое преобразование потенциально может привести к потере данных или искажению значения.

Явное приведение типа выполняется с помощью оператора приведения (type)expression, где type - тип, в который нужно привести значение, а expression - выражение, которое нужно привести к указанному типу.",57
"В чем состоит ""Принцип открытости/закрытости"" (2 принцип SOLID)?","Классы и модули должны быть открыты для расширения, но закрыты для модификации.",Изменение метода в классе не должно влиять на другие методы в том же классе.,"Классы должны быть открыты для изменений, чтобы обеспечить легкость модификации кода.","Все методы в классе должны быть открыты для переопределения в наследниках, а поля - закрыты.","Принцип открытости/закрытости из SOLID заключается в следующем:
""Программные сущности (классы, модули, функции и т.д.) должны быть открыты для расширения, но закрыты для модификации.""
Это означает, что код должен быть написан таким образом, чтобы добавление новой функциональности не требовало изменения уже существующего кода. Новые возможности должны добавляться через расширение, используя наследование, интерфейсы, композицию и другие техники, не нарушая работу существующих компонентов.",58
Что такое полиморфизм (3 принцип ООП)?,Возможность объектов одного класса использоваться как объекты другого класса с помощью общего интерфейса.,Это возможность создания объектов разных классов из одного абстрактного класса.,Способность объектов взаимодействовать только с объектами своего типа.,Возможность использовать один и тот же объект для разных целей в программе.,"В основе полиморфизма лежит идея, что объекты, имеющие общий интерфейс (например, общие методы), могут быть использованы согласно этому интерфейсу, независимо от их фактического типа. Это позволяет передавать объекты производных классов туда, где ожидается объект базового класса, и вызывать методы наследников, не зная их конкретного типа.",58
В каком формате сохраняет аудиоданные класс Microphone?,Audio clip asset,MP3 file,WAV file,OGG file,"Класс Microphone используется для доступа к микрофону компьютера или мобильного устройства и записи аудио с него. Он позволяет разработчикам создавать приложения, которые могут взаимодействовать с микрофоном, записывать звук, а также анализировать или воспроизводить аудиоданные в реальном времени. Это может быть полезно для создания голосового управления, аудио-игр или аудиоанализа в приложениях и играх.",59
Некоторые типы материалов включают в себя карты нормалей. Зачем нужна карта нормалей?,"Она создает детализацию поверхности на меше: неровности, вмятины и царапины.","Это система детализации, которая постепенно уменьшает количество полигонов по мере того, как камера удаляется.",Она заменяет геометрию для создания высокополигональных объектов.,Она программно уменьшает количество полигонов в мешах.,"Карта нормалей (Normal Map) в компьютерной графике используется для придания плоским или низкополигональным моделям визуального впечатления детализации и объемности. Она является одним из важных типов текстурных карт, используемых в рендеринге 3D-моделей.

В игровой разработке и визуализации карта нормалей позволяет обмануть взгляд зрителя, создавая эффект высокодетализированной поверхности, не добавляя фактически новых полигонов. Вместо этого она использует специальные цветовые данные, которые кодируют информацию о направлении нормалей поверхности каждого пикселя.",60
Что такое Zenject?,Это фреймворк для внедрения зависимостей.,"Это алгоритм сжатия данных, используемый для уменьшения размера файлов в Unity.",Это инструмент для создания сложных математических вычислений и алгоритмов в Unity.,Это библиотека для работы с звуками и аудиоэффектами в Unity.,"Zenject - это фреймворк для управления зависимостями и инъекции зависимостей (Dependency Injection, DI) в Unity. Он предоставляет удобные инструменты для организации структуры проекта и управления зависимостями между компонентами.",60
Какие из нижеперечисленных методов предназначены для создания или удаления объектов в Unity?,Instantiate() и Destroy(),Start() и FixedUpdate(),Update() и LateUpdate(),OnEnable() и OnDisable(),"Instantiate(): Метод принимает параметром префаб (Prefab) - шаблон объекта, который нужно создать, и  дополнительные параметры, такие как позиция и поворот и создает новый экземпляр объекта.

Destroy(): Этот метод используется для удаления игрового объекта со сцены во время игры. Он принимает в качестве параметра ссылку на удаляемый объект и уничтожает его, освобождая память и ресурсы, которые он занимал.",61
Где доступны члены с модификатором  internal?,Внутри того же проекта (сборки).,"Из любого места программы, включая другие классы и пространства имен.",Внутри того же класса и его производных классов (наследников).,"Только внутри того же класса, в котором они объявлены.","internal - это уровень доступа, который ограничивает доступ к членам класса только внутри той сборки, в которой они объявлены. Сборка - это единица компиляции, которая может представлять собой одну библиотеку, исполняемый файл или модуль. Если член класса объявлен с модификатором internal, он может быть использован в любом другом классе, находящемся в той же сборке, но будет недоступен для классов вне этой сборки.",62
Кому нужна функция Collaborate в Unity Teams?,"Членам команды для сохранения, обмена и синхронизации проектов Unity.","Разработчикам, которые вносят изменения в исходный код Unity.","Компаниям, которые собирают деньги на проекты через краудфандинг.",Разработчики используют как систему контроля версий.,"Функция Collaborate в Unity Teams нужна командам разработчиков, чтобы сохранять, совместно использовать и синхронизировать проекты Unity. Это обеспечивает более эффективную работу над проектами в команде, обмен файлами, контроль версий и совместное внесение изменений в проекты.",62
Зачем компонент PlayableDirector?,Управлять воспроизведением временной шкалы в сцене.,Записать игровой сеанс в видеофайл.,Переключаться между различными камерами сцены.,Параллельно запускать несколько функций на разных игровых объектах.,"Компонент PlayableDirector в Unity используется для управления временем и воспроизведения Timeline - это визуальной системы анимации, которая позволяет создавать сложные и интерактивные анимации событий в игре или приложении.

PlayableDirector позволяет проигрывать, останавливать, приостанавливать и переключать Timeline во время выполнения приложения. Это удобно для создания сценариев и кинематографичных моментов, так как вы можете контролировать события и анимацию объектов на сцене через таймлайн и скрипты.",63
Что такое куча и стек?,"Стек - это область памяти, используемая для хранения локальных переменных, а куча - это область динамической памяти для хранения объектов.","Стек - это место, где хранятся объекты и данные, а куча - это область памяти, используемая для выполнения арифметических операций.","Стек - это область памяти, где хранятся данные времени выполнения программы, а куча - место, где хранятся инструкции и код программы.","Стек - это область памяти, где хранятся структуры данных, а куча - это место, где хранятся функции и методы программы.","Куча (heap) и стек (stack) - это две основные области памяти, используемые в программировании, включая C#.

Стек (stack) - это область памяти, где хранятся локальные переменные методов, параметры методов, а также контекст вызова функций. Стек управляется автоматически и используется для хранения данных в порядке ""последний вошел - первый вышел"".
Куча (heap) - это область динамической памяти, где хранятся объекты и данные, которые создаются и управляются во время выполнения программы. В отличие от стека, размер кучи не фиксирован и может изменяться во время выполнения. ",64
"В чем состоит ""Принцип подстановки Барбары Лисков"" (3 принцип SOLID)?",Объекты базовых классов должны быть заменяемыми объектами производных классов.,Производный класс должен быть наследником только одного базового класса.,Все методы базового класса были переопределены в производных классах.,"Классы не могут быть изменены после их создания, чтобы обеспечить их стабильность.","Принцип подстановки Барбары Лисков:
""Объекты базовых классов должны быть заменяемыми объектами своих производных классов, и это не должно влиять на правильность программы.""

Предположим, у нас есть класс Bird с методом Fly(), и от него производные классы Penguin и Sparrow. По принципу LSP, мы должны быть уверены, что вызов метода Fly() на объектах Bird не вызовет ошибок или неожиданных поведений для классов Penguin и Sparrow. Может быть разумно переопределить метод Fly() для Penguin, чтобы он не делал ничего (так как пингвины не летают), но это не должно нарушать работу других частей программы, которые ожидают объекты типа Bird.",64
Что такое статический полиморфизм?,"Механизм, при котором одно и то же имя метода может использоваться для выполнения различных действий(перегрузка).","Механизм, позволяющий создавать новые методы во время выполнения программы.",Используется для выполнения разных действий в зависимости от значения переменной.,"Механизм, обеспечивающий динамическое связывание вызовов методов.","Статический полиморфизм (также известный как перегрузка или компиляционный полиморфизм) - это механизм в программировании, при котором одно и то же имя метода или оператора может использоваться для выполнения различных действий в зависимости от типов аргументов, переданных в метод.

Статический полиморфизм разрешается во время компиляции программы, и компилятор определяет, какой именно метод или оператор должен быть вызван на основе типов аргументов, используемых в вызове функции. Это позволяет перегружать методы или операторы с различными типами параметров и обрабатывать их соответствующим образом.",65
Что такое batching в Unity?,"Это механизм, который позволяет объединить несколько объектов или графических элементов в один draw call.",Это процесс взаимодействия объектов с разными материалами для создания новых эффектов в игре.,"Это техника, которая используется для управления пакетами данных в Unity.",Это метод оптимизации текстур и уровней детализации для улучшения графики в Unity.,"Batching (объединение) в Unity - это процесс, при котором несколько графических элементов объединяются в один, чтобы уменьшить количество draw call и улучшить производительность игры.
Batching помогает оптимизировать производительность игры, особенно при работе с большим количеством объектов на сцене. Однако не все объекты могут быть объединены, и оптимизация требует соблюдения определенных ограничений и правил.",66
Какое утверждение лучше всего описывает функцию Quaternion.Euler?,"Преобразует ориентацию, измеренную в градусах, в кватернион.","Преобразует кватернион в строку, которая хранит его вращение по осям X, Y и Z в градусах.",Преобразует ориентацию из радиан в кватернион.,Он преобразует кватернион в Vector3.,"Метод Quaternion.Euler(x, y, z) в Unity используется для создания кватерниона, представляющего поворот вокруг осей X, Y и Z.

Он принимает три значения в градусах: x, y и z, и возвращает кватернион, который представляет соответствующий поворот. Этот метод удобен для создания кватернионов, когда углы поворота заданы в удобном для разработчика формате в градусах.",66
"Что подразумевается под ""управлением зависимостями""?","Это процесс установления, передачи и управления зависимостями между компонентами программы. ",Это способность обращаться к родительским компонентам и использовать их ресурсы.,Это процесс оценки взаимодействия между различными элементами программы и определения их важности.,Это способность программы автоматически создавать зависимости между компонентами без вмешательства программиста.,"Зависимости - это отношения между различными компонентами, модулями или объектами программы, где один элемент (называемый клиентом или потребителем) требует доступа к другому элементу (называемому сервисом или поставщиком) для выполнения своих задач.
Управление зависимостями - это процесс установления, передачи и управления зависимостями между компонентами программы. Один из способов управления зависимостями - это использование паттернов инъекции зависимостей (Dependency Injection, DI), которые позволяют создавать слабые связи между компонентами и обеспечивают более гибкую структуру программы.",67
