Text,Answers0,Answers1,Answers2,Answers3,Explanation,Difficulty
Что такое Boxing/Unboxing в C#?,Boxing и Unboxing - это процессы преобразования значимых типов данных в ссылочные типы и обратно. ,"Boxing и Unboxing - это специальные методы, используемые для сериализации и десериализации объектов в C#.","Boxing и Unboxing - это механизмы, которые позволяют создавать анонимные типы и работать с ними в C#.",Boxing и Unboxing - это способы управления памятью и освобождения ресурсов в C#.,"Boxing - это процесс преобразования значимого типа данных в экземпляр объекта соответствующего ссылочного типа. При упаковке (boxing) значение переменной копируется в новый объект-контейнер на куче, а переменная становится ссылкой на этот объект. 
int number = 42;
object boxedNumber = number;
Unboxing - это процесс извлечения значения из упакованного объекта и преобразования его обратно в исходный значимый тип данных. При распаковке (unboxing) значение извлекается из объекта-контейнера и преобразуется в исходный тип данных.
object boxedNumber = 42;
int number = (int)boxedNumber;
",29
"
Что такое дженерики?","Дженерики - это механизм, позволяющий создавать обобщенные типы, методы и классы.","Дженерики - это способ использования методов, которые автоматически определяют типы данных во время выполнения программы.",Дженерики - это механизм для работы с текстовыми данными.,"Дженерики - это набор заранее определенных обобщенных классов и методов, которые можно использовать в языке C#.","Дженерики (Generics) в C# представляют механизм, который позволяет создавать обобщенные типы, классы и методы, которые могут работать с различными типами данных. Это позволяет повторно использовать код и обеспечивает безопасность типов на этапе компиляции.
public static void Swap<T>(ref T a, ref T b)
{
    T temp = a;
    a = b;
    b = temp;
}
В данном примере метод Swap является обобщенным, так как определен с параметром типа T. ",29
Где доступны члены с модификатором private?,"Только внутри того же класса, в котором они объявлены.",Внутри того же проекта (сборки).,Внутри того же класса и его производных классов (наследников).,"Из любого места программы, включая другие классы и пространства имен.","Члены с модификатором private доступны только внутри того же класса, в котором они объявлены. Это означает, что члены с модификатором private недоступны из других классов, даже если эти классы находятся в той же сборке.",30
Зачем нужны отдельные Update и FixedUpdate?,"Update используют, где важна зависимость от времени, FixedUpdate - где важна независимость от FPS.","Update предназначен для физических расчетов, а FixedUpdate - для анимации и пользовательского ввода.",Update работает в отдельном потоке от FixedUpdate.,"Update и FixedUpdate делают одно и то же, но обрабатываются в произвольной последовательности.","Отделение логики обновления на Update и FixedUpdate помогает более точно контролировать обновление объектов. Это особенно важно для физических расчетов и других операций, которые должны происходить с постоянной частотой.
Update: вызывается на каждом кадре рендеринга и используется для обновления логики, которая зависит от времени (пользовательский ввод, движение объектов, анимации).

FixedUpdate: вызывается с фиксированной частотой(0.02 сек). Он предназначен для обработки физических расчетов и других операций, которые должны выполняться с постоянной частотой независимо от FPS игры.",31
"Чтобы вызвалось событие OnTriggerEnter при столкновении двух объектов, какие два компонента обязательно должны быть на этих объектах?",Rigidbody и Collider,Collider и MeshRenderer,Collider и MeshFilter,MeshRenderer и MeshFilter,"Компонент Rigidbody используется для добавления физических свойств объекту, позволяя ему взаимодействовать с физическим миром, подвергаться силам, гравитации и имитировать реалистичные движения.

Компонент Collider определяет границы и форму объекта, позволяя ему взаимодействовать с другими объектами через столкновения и коллизии. Collider также используется для обработки физического взаимодействия с окружающими объектами и другими физическими телами в сцене.",31
Что такое Coroutines в Unity? ,"Механизм, который позволяет создавать асинхронные операции и управлять временем выполнения задач в игре.","Механизм, позволяющий выполнять длительные операции без влияния на производительность игры.","Механизм, применяемый для асинхронной обработки пользовательского ввода.","Механизм, который используется для синхронного выполнения кода без задержек.","Coroutines в Unity - это механизм, который позволяет создавать асинхронные операции и управлять временем выполнения задач в игре. Они позволяют выполнять отложенные действия или анимации без блокировки основного потока выполнения, что облегчает выполнение сложных задач, таких как анимации, переходы между сценами и другие длительные операции.

Работа с Coroutines происходит с помощью ключевого слова yield, которое позволяет приостанавливать выполнение функции и возобновлять его позднее.",32
"В каком порядке вызываются методы жизненного цикла MonoBehaviour, начиная с инициализации объекта до его уничтожения?","Awake, Start, FixedUpdate, Update, LateUpdate, OnDestroy","Awake, Start, Update, FixedUpdate, LateUpdate, OnDestroy","Start, Awake, Update, LateUpdate, FixedUpdate, OnDestroy"," Start, Awake, FixedUpdate, LateUpdate, Update, OnDestroy","Awake() -  для инициализации переменных и компонентов объекта.
Start() - для запуска процессов, которые зависят от других объектов.
FixedUpdate() -  для работы с физикой и перемещения объектов.
Update() -   для обновления логики объекта и обработки пользовательского ввода.
LateUpdate() -  для выполнения логики, которая зависит от обновления других объектов.
OnDestroy() - вызывается перед уничтожением объекта. Используется для освобождения ресурсов и очистки памяти.",33
Что такое Cinemachine в Unity?,Это пакет инструментов для создания сложных камерных движений и управления камерами в игре. ,Это специальный редактор для создания анимированных камерных эффектов.,Это библиотека для создания трехмерных моделей и анимаций в Unity.,Это компонент для отображения анимированных эффектов на сцене.,"Cinemachine - это пакет для Unity, который предоставляет удобные инструменты для создания сложных камерных систем. Он позволяет легко настраивать и контролировать камеры в игре, добавлять эффекты переходов между камерами, управлять камерой в режиме реального времени и создавать динамические камерные треки. Cinemachine упрощает процесс создания кинематографических камерных эффектов и обеспечивает более гибкий и эффективный подход к управлению камерами в игровом проекте.",33
Какой атрибут C# отображает private переменную в инспекторе объектов?, SerializedField,Serializable, HideInInspector, Range,"Атрибут SerializedField используется в Unity для отображения и редактирования приватных или защищенных переменных в инспекторе редактора, делая их доступными для редактирования без необходимости делать их публичными. Таким образом, можно сохранить инкапсуляцию и одновременно предоставить возможность редактирования значений в инспекторе без доступа к ним извне класса.",34
Сколько по времени по умолчанию занимает FixedUpdate?,0.02 секунды,"Время зависит от сложности логики, которую вы выполняете в этом методе.",1 миллисекунду,один кадр времени (1/60 секунды на 60 FPS).,"FixedUpdate вызывается с фиксированной частотой, которая по умолчанию равна 50 раз в секунду (каждые 0.02 секунды). Однако это значение может быть изменено в настройках проекта.",35
Что такое Raycast в Unity3D и для чего он используется?,Это метод для проверки столкновения луча с объектами на сцене.,Это компонент для обработки пользовательского ввода.,Это метод для установки камеры на сцене.,Это компонент для создания луча света на сцене.,"Raycast - это метод, используемый для определения столкновений луча (ray) с объектами в сцене. Луч представляет собой виртуальный луч света, который исходит из начальной точки и направлен в определенном направлении. Raycast проверяет, пересекается ли этот луч с какими-либо коллайдерами в сцене и возвращает информацию о первом объекте, с которым происходит столкновение.",35
Что делает атрибут Range?,Ограничивает значение переменной с помощью ползунка.,Он проверяет значения переменных через виджет текстового поля.,Он ограничивает значения переменных с помощью виджета выбора цвета.,Он представляет допустимые варианты переменной в раскрывающемся списке.,"Атрибут [Range(min, max)] в Unity используется для ограничения диапазона значений числовых полей (например, float или int) в инспекторе. Он позволяет задать минимальное и максимальное значение, которое может принимать данное числовое поле.

Применение атрибута [Range] к числовому полю позволяет разработчику установить ограничение значений в инспекторе редактора Unity, чтобы предотвратить ввод недопустимых или неправильных значений для данного поля.",36
Кому доступны переменные с модификатором protected на уровне класса?,Доступны самому классу и его производным классам (наследникам) ,"Доступны только внутри класса, где они объявлены.","Доступны только в классах, находящихся в том же пространстве имен, что и класс, где они объявлены.","Доступны только в классах, находящихся в том же файле исходного кода, что и класс, где они объявлены.","Переменные с модификатором protected на уровне класса доступны самому классу, производным классам (наследникам) и любым другим классам в той же самой сборке (assembly).",37
Что делает аттрибут [Space(20)]?,Он делает отступ 20 пикселей над переменной внутри инспектора объектов.,Он вставляет 20 знаков пробела в качестве значения по умолчанию.,Он вставляет 20 пикселей слева и справа от переменной в инспекторе.,Он ограничивает количество знаков пробела в 20 символов.,"Атрибут [Space(X)] используется в Unity для добавления вертикального пространства (отступа) между сериализованными полями в инспекторе. В скобках указывается значение, которое определяет количество пикселей отступа.

Например, если у нас есть несколько сериализованных полей в MonoBehaviour-скрипте, и мы хотим добавить большой вертикальный отступ между ними в инспекторе, мы можем применить атрибут [Space(20)] перед полем, которое должно быть разделено от других.",37
"Может ли класс реализовать два интерфейса, у которых объявлены одинаковые методы?","Класс может реализовать два интерфейса с одинаковыми методами, но нужно указать принадлежность каждого метода.","Класс может реализовать два интерфейса с одинаковыми методами, но их реализация должна быть одинаковой.",При вызове метода будет использоваться реализация только первого интерфейса.,"Класс не может реализовать два интерфейса с одинаковыми методами, так как это вызывает конфликт в имени метода.","Когда класс реализует два интерфейса с одинаковыми методами, он должен явно указать, какой метод относится к какому интерфейсу, чтобы избежать неоднозначности. Это делается путем использования полной квалификации имени метода, указывающей на соответствующий интерфейс:
((IInterface1)myObj).MyMethod();   // Вызов MyMethod из IInterface1
((IInterface2)myObj).MyMethod();  // Вызов MyMethod из IInterface2",38
Что такое draw call в Unity?,"Это команда для отображения объектов на экране, которая содержит информацию о параметрах объекта. ","Это часть процесса рендеринга, которая отвечает за расчет освещения.",Это процесс обработки физического взаимодействия между объектами в Unity.,"Это способ определения, какие объекты должны быть отображены на экране.","Draw call (отрисовка) в Unity - это процесс отправки графических команд на отрисовку объектов на экране. Каждый раз, когда Unity отрисовывает объекты на сцене, он генерирует draw call для каждого объекта или набора объектов с одинаковыми материалами и настройками отображения.

Draw call содержит информацию о том, какой объект отрисовать, какой материал использовать, его позицию, поворот и масштаб, а также другие настройки, такие как режимы смешивания, отключение или включение затенения, маскировка и т. д.",39
"Что делает этот код:
Float Answer = Random.value * 10f;",Выбирает случайное значение между 0 и 10,Выбирает случайное значение больше 10,Выбирает случайное значение меньше 10,Выбирает случайное значение кратное 10,"Random.value возвращает случайное значение с плавающей точкой в диапазоне от 0.0 (включительно) до 1.0 (исключительно). Таким образом, это функция, которая генерирует случайное число с плавающей точкой от 0 до 1.",39
Что такое инкапсуляция (1 принцип ООП)?,Сокрытие деталей реализации объектов и предоставление интерфейса для работы с ними.,"Процесс превращения объекта в капсулу, которая может быть использована для хранения других объектов.",Способность объекта взаимодействовать только с объектами своего класса.,"Принцип, который запрещает использование публичных методов и полей в классе.","Инкапсуляция (Encapsulation) - это первый принцип ООП, который заключается в объединении данных и методов, работающих с этими данными, в единый объект (класс), и предоставлении доступа к ним только через интерфейс (публичные методы) этого объекта. Суть инкапсуляции состоит в том, что внутреннее состояние объекта остается скрытым от внешнего кода, и изменения данных объекта производятся только через установленные методы.
Главная цель инкапсуляции - обеспечить контроль над доступом к данным и методам объекта, предоставляя защищенный интерфейс для работы с объектом. ",40
Какое утверждение не соответствует действительности?,Только у гуманоидных персонажей есть кости.,"Функция обновления никогда не вызывается автоматически, пока объект не активен.",Корутины будут продолжать работать на неактивных объектах.,Все скрипты компонентов наследуются от MonoBehaviour.,"Кости (bones) обычно используются в анимации персонажей или объектов для управления их движением. В компьютерной графике и 3D-моделировании кости представляют собой невидимые точки или сущности, которые используются для создания иерархической структуры, описывающей и управляющей движением модели.",41
"Что такое графическая библиотека (OpenGL, DirectX)?","Графическая библиотека это набор инструментов и функций, для управления графикой и визуальными эффектами.","Графическая библиотека это набор физических компонентов, которые подключаются для улучшения графического вывода.",Графическая библиотека это программное обеспечение для создания и редактирования фотографий и изображений.,"Графическая библиотека это система, которая управляет размещением и отображением графических элементов на веб-сайтах.","Графическая библиотека, такая как OpenGL или DirectX, представляет собой набор программных интерфейсов и функций, которые разработчики могут использовать для создания и управления графикой в приложениях. Они обеспечивают доступ к низкоуровневым операциям рендеринга и взаимодействию с видеокартой. 
Пример: команда на C++  ""pDeviceContext->ClearRenderTargetView(pRenderTargetView, DirectX::Colors::SteelBlue);""  указывает устройству DirectX очистить буфер заднего фона и заполнить его указанным цветом перед началом отрисовки нового кадра. ",41
